{
  "project_id": "00000001-0000-4000-8000-000000000001",
  "interface_id": "00000002-0000-4000-8000-000000000001",
  "environment_id": "00000003-0000-4000-8000-000000000001",
  "ingestion_id": "00000004-0000-4000-8000-000000000001",
  "base_revision_id": "00000005-0000-4000-8000-000000000001",
  "extractor_version": null,
  "assessment": null,
  "incoming_definition": null
}
